{
  "organization_id": "dialogue-os-example",
  "dialogue_os_version": "0.2",
  "agent_id": "lead-research-01",
  "role": "LEAD",
  "domain": "research",
  "supervisor_id": "chief-01",
  "authority_source": "mission:M-001",
  "allowed_tools": ["web.search", "evidence.store", "worker.spawn"],
  "forbidden_actions": ["self_promote", "grant_own_tools", "financial_transaction"],
  "side_effect_classes": ["READ_ONLY", "REVERSIBLE_INTERNAL"],
  "communication_policy": "chief-lead-standing-path",
  "execution_policy": "lead-standard-v0.2",
  "memory_policy": "curated-no-secrets-v0.2",
  "evidence_policy": "evidence-required-v0.2",
  "mission_scope": {"mission_ids": ["M-001"]},
  "created_by": "chief-01",
  "created_at": "2026-07-14T12:00:00Z",
  "expires_at": null,
  "manifest_hash": "sha256:example-not-for-production"
}
